{
  "theme_name": "cogni-work",
  "colors": {
    "primary": "#111111",
    "secondary": "#333333",
    "accent": "#C8E62E",
    "accent_muted": "#A8C424",
    "accent_dark": "#8BA31E",
    "background": "#FAFAF8",
    "surface": "#F2F2EE",
    "surface2": "#e8e8e4",
    "surface_dark": "#111111",
    "border": "#E0E0DC",
    "text": "#111111",
    "text_light": "#FFFFFF",
    "text_muted": "#6B7280"
  },
  "status": {
    "success": "#2E7D32",
    "warning": "#E5A100",
    "danger": "#D32F2F",
    "info": "#1565C0"
  },
  "fonts": {
    "headers": "'Bricolage Grotesque', 'DM Sans', -apple-system, BlinkMacSystemFont, 'Segoe UI', sans-serif",
    "body": "'Outfit', 'DM Sans', -apple-system, BlinkMacSystemFont, 'Segoe UI', sans-serif",
    "mono": "'JetBrains Mono', 'Fira Code', Consolas, monospace"
  },
  "google_fonts_import": "@import url('https://fonts.googleapis.com/css2?family=Bricolage+Grotesque:wght@400;500;600;700&family=JetBrains+Mono:wght@400;500&family=Outfit:wght@300;400;500;600;700&display=swap');",
  "radius": "12px",
  "shadows": {
    "sm": "0 1px 3px rgba(0,0,0,0.04), 0 1px 2px rgba(0,0,0,0.06)",
    "md": "0 4px 16px rgba(0,0,0,0.06), 0 1px 4px rgba(0,0,0,0.04)",
    "lg": "0 12px 40px rgba(0,0,0,0.1), 0 4px 12px rgba(0,0,0,0.05)",
    "xl": "0 24px 64px rgba(0,0,0,0.14), 0 8px 20px rgba(0,0,0,0.06)"
  }
}
